{
  "$schema": "https://json-schema.org/draft/2020-12/schema",
  "$id": "https://victoroffgroup.com/contracts/shareholder-action.v1.schema.json",
  "title": "Shareholder action",
  "type": "object",
  "additionalProperties": false,
  "required": ["schemaVersion", "id", "title", "shortLabel", "audience", "rule", "deadline", "preparation", "ownerSystem", "handoff", "fallback", "source", "reviewedAt", "expiresAt", "classification"],
  "properties": {
    "schemaVersion": { "const": "shareholder-action.v1" },
    "id": { "type": "string", "minLength": 1 },
    "title": { "type": "string", "minLength": 1 },
    "shortLabel": { "type": "string", "minLength": 1 },
    "audience": { "type": "string", "minLength": 1 },
    "rule": { "type": "string", "minLength": 1 },
    "deadline": { "type": "string", "minLength": 1 },
    "preparation": { "type": "array", "minItems": 1, "items": { "type": "string", "minLength": 1 } },
    "ownerSystem": { "type": "string", "minLength": 1 },
    "handoff": {
      "type": "object",
      "additionalProperties": false,
      "required": ["label", "url", "external"],
      "properties": {
        "label": { "type": "string", "minLength": 1 },
        "url": { "type": "string", "format": "uri", "pattern": "^https://" },
        "external": { "const": true }
      }
    },
    "fallback": { "type": "string", "minLength": 1 },
    "source": {
      "type": "object",
      "additionalProperties": false,
      "required": ["owner", "url"],
      "properties": {
        "owner": { "type": "string", "minLength": 1 },
        "url": { "type": "string", "format": "uri", "pattern": "^https://" }
      }
    },
    "reviewedAt": { "type": "string", "format": "date" },
    "expiresAt": { "type": "string", "format": "date" },
    "classification": { "const": "public" }
  }
}
